{
  "meta": {
    "title": "Lyra — v2 Dependency Graph",
    "date": "2026-04-15",
    "issue": {
      "repo": "Roxabi/lyra",
      "issue": 445
    },
    "label_prefix": "graph:",
    "category": "plan",
    "cat_label": "Plan",
    "color": "amber",
    "repos": [
      "Roxabi/lyra"
    ]
  },
  "title_rules": [
    {
      "pattern": "^(feat|fix|chore|docs|refactor|test|ci|perf|style|epic)(\\([^)]+\\))?\\s+\\[([^\\]]+)\\]\\s*:\\s*",
      "replacement": "$3 · "
    },
    {
      "pattern": "^(feat|fix|chore|docs|refactor|test|ci|perf|style|epic)(\\([^)]+\\))?\\[([^\\]]+)\\]\\s*:\\s*",
      "replacement": "$3 · "
    },
    {
      "pattern": "^(feat|fix|chore|docs|refactor|test|ci|perf|style|epic)(\\([^)]+\\))?\\s*:\\s*",
      "replacement": ""
    },
    {
      "pattern": "^M\\d+\\s*[—\\-]\\s*",
      "replacement": ""
    },
    {
      "pattern": "\\s*[—\\-]\\s+.+$",
      "replacement": ""
    },
    {
      "pattern": "\\s*\\+\\s+.+$",
      "replacement": ""
    }
  ],
  "lanes": [
    {
      "code": "a",
      "name": "NATS maturity",
      "color": "a",
      "epic": null,
      "order": [
        {
          "repo": "Roxabi/lyra",
          "issue": 568
        },
        {
          "repo": "Roxabi/lyra",
          "issue": 572
        },
        {
          "repo": "Roxabi/lyra",
          "issue": 576
        },
        {
          "repo": "Roxabi/lyra",
          "issue": 660
        },
        {
          "repo": "Roxabi/lyra",
          "issue": 662
        },
        {
          "repo": "Roxabi/lyra",
          "issue": 687
        }
      ],
      "par_groups": {
        "a_m0": [
          {
            "repo": "Roxabi/lyra",
            "issue": 568
          },
          {
            "repo": "Roxabi/lyra",
            "issue": 572
          },
          {
            "repo": "Roxabi/lyra",
            "issue": 576
          }
        ],
        "a_m1": [
          {
            "repo": "Roxabi/lyra",
            "issue": 660
          },
          {
            "repo": "Roxabi/lyra",
            "issue": 662
          },
          {
            "repo": "Roxabi/lyra",
            "issue": 687
          }
        ]
      },
      "bands": [
        {
          "before": {
            "repo": "Roxabi/lyra",
            "issue": 568
          },
          "text": "M0 tail ∥"
        },
        {
          "before": {
            "repo": "Roxabi/lyra",
            "issue": 660
          },
          "text": "M1 ∥"
        }
      ]
    },
    {
      "code": "b",
      "name": "Containerize",
      "color": "b",
      "epic": {
        "issue": 605,
        "label": "containerize",
        "tag": "M1"
      },
      "order": [
        {
          "repo": "Roxabi/lyra",
          "issue": 606
        },
        {
          "repo": "Roxabi/lyra",
          "issue": 612
        },
        {
          "repo": "Roxabi/lyra",
          "issue": 607
        },
        {
          "repo": "Roxabi/lyra",
          "issue": 608
        },
        {
          "repo": "Roxabi/lyra",
          "issue": 609
        },
        {
          "repo": "Roxabi/lyra",
          "issue": 610
        },
        {
          "repo": "Roxabi/lyra",
          "issue": 611
        },
        {
          "repo": "Roxabi/lyra",
          "issue": 657
        },
        {
          "repo": "Roxabi/lyra",
          "issue": 661
        }
      ],
      "par_groups": {
        "b0": [
          {
            "repo": "Roxabi/lyra",
            "issue": 606
          },
          {
            "repo": "Roxabi/lyra",
            "issue": 612
          }
        ],
        "b1": [
          {
            "repo": "Roxabi/lyra",
            "issue": 608
          },
          {
            "repo": "Roxabi/lyra",
            "issue": 609
          }
        ],
        "b2": [
          {
            "repo": "Roxabi/lyra",
            "issue": 611
          },
          {
            "repo": "Roxabi/lyra",
            "issue": 657
          }
        ]
      },
      "bands": []
    },
    {
      "code": "c1",
      "name": "LiteLLM",
      "color": "c1",
      "epic": {
        "issue": 663,
        "label": "LiteLLM",
        "tag": "M2"
      },
      "order": [
        {
          "repo": "Roxabi/lyra",
          "issue": 674
        },
        {
          "repo": "Roxabi/lyra",
          "issue": 665
        },
        {
          "repo": "Roxabi/lyra",
          "issue": 666
        }
      ],
      "par_groups": {},
      "bands": []
    },
    {
      "code": "c2",
      "name": "lyra_harness",
      "color": "c2",
      "epic": {
        "issue": 633,
        "label": "harness",
        "tag": "M2"
      },
      "order": [
        {
          "repo": "Roxabi/lyra",
          "issue": 634
        },
        {
          "repo": "Roxabi/lyra",
          "issue": 521
        },
        {
          "repo": "Roxabi/lyra",
          "issue": 635
        },
        {
          "repo": "Roxabi/lyra",
          "issue": 636
        },
        {
          "repo": "Roxabi/lyra",
          "issue": 637
        },
        {
          "repo": "Roxabi/lyra",
          "issue": 638
        },
        {
          "repo": "Roxabi/lyra",
          "issue": 639
        }
      ],
      "par_groups": {
        "c2_0": [
          {
            "repo": "Roxabi/lyra",
            "issue": 634
          },
          {
            "repo": "Roxabi/lyra",
            "issue": 521
          }
        ],
        "c2_1": [
          {
            "repo": "Roxabi/lyra",
            "issue": 635
          },
          {
            "repo": "Roxabi/lyra",
            "issue": 636
          }
        ]
      },
      "bands": []
    },
    {
      "code": "c3",
      "name": "lyra_cli",
      "color": "c3",
      "epic": {
        "issue": 628,
        "label": "lyra_cli",
        "tag": "M2"
      },
      "order": [
        {
          "repo": "Roxabi/lyra",
          "issue": 629
        },
        {
          "repo": "Roxabi/lyra",
          "issue": 630
        },
        {
          "repo": "Roxabi/lyra",
          "issue": 631
        },
        {
          "repo": "Roxabi/lyra",
          "issue": 632
        }
      ],
      "par_groups": {
        "c3_0": [
          {
            "repo": "Roxabi/lyra",
            "issue": 629
          },
          {
            "repo": "Roxabi/lyra",
            "issue": 630
          }
        ]
      },
      "bands": []
    },
    {
      "code": "d",
      "name": "Observability",
      "color": "d",
      "epic": {
        "issue": 667,
        "label": "OTel pipeline",
        "tag": "M3"
      },
      "order": [
        {
          "repo": "Roxabi/lyra",
          "issue": 673
        },
        {
          "repo": "Roxabi/lyra",
          "issue": 669
        },
        {
          "repo": "Roxabi/lyra",
          "issue": 671
        },
        {
          "repo": "Roxabi/lyra",
          "issue": 670
        },
        {
          "repo": "Roxabi/lyra",
          "issue": 672
        }
      ],
      "par_groups": {
        "d0": [
          {
            "repo": "Roxabi/lyra",
            "issue": 670
          },
          {
            "repo": "Roxabi/lyra",
            "issue": 672
          }
        ]
      },
      "bands": []
    },
    {
      "code": "e",
      "name": "Hub stateless",
      "color": "e",
      "epic": {
        "issue": 640,
        "label": "hub sheds Pool",
        "tag": "M4 · deferred",
        "defer": true
      },
      "order": [
        {
          "repo": "Roxabi/lyra",
          "issue": 641
        },
        {
          "repo": "Roxabi/lyra",
          "issue": 642
        }
      ],
      "par_groups": {},
      "bands": []
    },
    {
      "code": "f",
      "name": "Plugins",
      "color": "f",
      "epic": null,
      "order": [
        {
          "repo": "Roxabi/lyra",
          "issue": 644
        },
        {
          "repo": "Roxabi/lyra",
          "issue": 645
        }
      ],
      "par_groups": {},
      "bands": []
    },
    {
      "code": "g",
      "name": "Voice",
      "color": "g",
      "epic": null,
      "order": [
        {
          "repo": "Roxabi/lyra",
          "issue": 658
        },
        {
          "repo": "Roxabi/lyra",
          "issue": 603
        },
        {
          "repo": "Roxabi/lyra",
          "issue": 689
        },
        {
          "repo": "Roxabi/lyra",
          "issue": 690
        },
        {
          "repo": "Roxabi/lyra",
          "issue": 691
        }
      ],
      "par_groups": {},
      "bands": []
    },
    {
      "code": "h",
      "name": "Deploy ops",
      "color": "h",
      "epic": {
        "issue": 693,
        "label": "autodeploy",
        "tag": "M1"
      },
      "order": [
        {
          "repo": "Roxabi/lyra",
          "issue": 695
        },
        {
          "repo": "Roxabi/lyra",
          "issue": 696
        },
        {
          "repo": "Roxabi/lyra",
          "issue": 694
        },
        {
          "repo": "Roxabi/lyra",
          "issue": 697
        },
        {
          "repo": "Roxabi/lyra",
          "issue": 698
        },
        {
          "repo": "Roxabi/lyra",
          "issue": 699
        },
        {
          "repo": "Roxabi/lyra",
          "issue": 700
        },
        {
          "repo": "Roxabi/lyra",
          "issue": 701
        },
        {
          "repo": "Roxabi/lyra",
          "issue": 702
        }
      ],
      "par_groups": {
        "h0": [
          {
            "repo": "Roxabi/lyra",
            "issue": 695
          },
          {
            "repo": "Roxabi/lyra",
            "issue": 696
          }
        ],
        "h1": [
          {
            "repo": "Roxabi/lyra",
            "issue": 698
          },
          {
            "repo": "Roxabi/lyra",
            "issue": 699
          },
          {
            "repo": "Roxabi/lyra",
            "issue": 700
          }
        ]
      },